text,label
Not necessarily always true just starts demanding higher possibly currently unknown forms of EDAC. If they can get reproducibility I'm sure the science will start working on getting that number up and making it easier for EDAC. If anything I'd that's the kind of number of plausibility that will light a fire in those connected areas of science should reproducibility happen.,figurative
Sheinbaum again dismisses Trump's threat of sending troops to Mexico: 'We do not want intervention',literal
Pardoned Jan. 6 rioter arrested on child molestation charges adding to pattern,literal
I like it you can have your opinion on it but mine won't change.,literal
Saying you're bad at math is like saying you're bad at thinking From inicial school math to abstract mathematics courses it's essentially pure reasoning; all properties and theorems have proofs and a logical explanation. That said many people struggle not because they genuinely lack the ability to learn but because they never bothered to learn the fundamentals. And math is cumulative; if you don't know one topic it's difficult to move on to the next.,literal
I think this sub is generally very quick to call things abuse but this absolutely is abuse. Start developing an exit plan.,figurative
Thanksgiving dinner is massively overhyped... Here's my scorching hot take...Thanksgiving dinner isn't actually good. Turkey mashed potatoes stuffing...they're three of the blandest most flavorless foods imaginable and if they weren't wrapped in decades of cultural hype nobody would ever look forward to this meal...,figurative
Are you not bisecting your leafy greens before forking them?,literal
Forgiving someone doesn't automatically mean they have to forgive you if the roles were reversed context is people sometimes claim its hypocrisy if a person forgave you for something and you dont forgive them for the same thing. The issue is everyone have different priorities. What you was forgiven for may have not been of value to them as it was if the offensive was committed against you...,literal
I'm sick and tired of a President that doesn't respect women. Donald you have no right to speak to a woman or any person as a matter of fact in such a degrading manner. Fact is you are the PIG in the room,figurative
we can start from the beginning if you want when hamas did not return all the hostages in the timeframe delineated. (and they still have not). seems like the first violation was Hamas.,literal
House passes resolution demanding Epstein files release,literal
'Full of s—t': Why Jasmine Crockett and others aren't buying Trump and Republicans' change of heart on Epstein files. Crockett said she believes Trump and Republicans will ultimately bury the contents of the files despite their newfound public support for the release.,figurative
Altered carbon season 2 was phenomenal but Anthony Mackie ruined it. As the title stated. The story was great the source material was fantastic. But here's the caveat Mackie's range was not fit for the role and because netflix season 2 is all we get. They miss cast and we get screwed.,figurative
Fantasy Football leagues should take Thanksgiving off Thanksgiving and Football they are basically one in each other. And that is great getting together with family to watch the three NFL games every Thanksgiving is very much part of the tradition and I very much cherish that experience at my Thanksgiving gatherings. But when it comes to fantasy you have a lot of family members distracted on their phones worried about their bets their standing and all of the heavy attention it requires...,literal
He'd be spending his retirement in prison if he didn't run again & win.,literal
Bill targeting White House ballroom donations introduced by Democrats,literal
Board it or let it go as always. For those who say Eu is 5x stronger than ru i agree. But being stronger means nothing if you dont act.,literal
destination weddings are selfish not always of course but if you KNOW your friends and family can't afford it or can barely afford it and you know it's going to be difficult for most of your guests to make arrangements it's just a shitty move...,literal
how can you keep making money from the sales of weapons to europe to give to ukraine and look innocent to the world at the same time? by regurgitating the same narrative over and over and over and over,figurative
What is the equivalent ceasefire Israel broke to the one Hamas broke on October 7? Honestly want to understand.,literal
Then...why tf did he heel turn and suddenly openly endorse supporting the vote???,figurative
Space Age Love Song is arguably A Flock Seagulls best song. And not I Ran (So Far Away). A Flock of Seagulls is definitely most known for I Ran and while I absolutely do love the song it's not their best song. Space Age Love Song literally hits all the right chords. Perfect New Wave.,figurative
The godfather part 2 is not as good as the godfather part 1 The main story with Michael is fine (even though I feel like Michael cames out as almost invincible which Vito wasn't in part 1) but all the parts with young Vito in part 2 were genuinely boring and worse of all unnecessary and should have been cut to give more space to the main story. I really don't feel like there was any need to expand on Vito's story and his narrative arch in part 2 wasn't well done,literal
He was an NSC staffer so he may not legally be allowed to disclose the contents (although he did in very general terms). Note that he is the twin brother of Alexander Vindman who was involved in Trump's first impeachment.,literal
I totally understand that mindset. Again though if he rest of the world stops pouring money and equipment in Ukraine they aren't going to have any other option. I think this is eventually going to happen.,figurative
colorless gemstones are the jewelry equivalent of beige walls White sapphire diamond quartz etc. Sure they sparkle but they're boring. Emeralds pink sapphires chocolate diamonds etc. are all more visually exciting than a simple clear flawless diamond or other similar looking stone.,figurative
Modern smartphone camera tech fucking sucks. Photography on an iPhone absolutely blows cock why tf are they putting so much engineering into their cameras just to be used casually by people who are complacent/blind to the horrid post processing done to their photos that you cant even escape in RAW mode? I bought an old ass digicam from 2001 with a 6.0 megapixel sensor and the photos are so much sharper and charming than anything iPhone can do.,literal
She was invisible for most of Biden's term the dems skipped the primary and pushed Biden as the re-running candidate then decided last second that actually Kamala should be the dem frontrunner. Democrat voters never got to choose. We were told who to vote for and that's not really what Democrat voters like.,figurative
Totally agree and well put! Its a shame people have downvoted you into the negatives!!,literal
Mike Johnson's Gamble on Releasing Epstein Files Blows Up in His Face,figurative
Trump's 'piggy' comment extends his lengthy record of routine misogyny,literal
Google's Demis Hassabis warns of a potential AI bubble,figurative
Gate attendants at airports should be more genial and presentable good morning passengers thank you for joining us at frontier Airlines flight #### with nonstop service to (city name). We will begin boarding in approximately 5 minutes... I just think the gate attendants could make an effort to address passengers with a little more geniality... But everyone is always telling that professionalism is important. And while safety is at the forefront I think it's important that airports try going back to creating an experience which makes people less reluctant to fly.,literal
Can anyone explain why we live in a world where anyone cares what Laura Loomer thinks even if she is right?,literal
Russia temporarily halts flights at Krasnodar airport,literal
AOC warns we may be in a 'massive' AI bubble with '2008-style threats to economic stability',figurative
Spoons are the superior utensil to scoop someone's eyeball out with.,figurative
Once I read Anne Bower @lawfare 's piece the other week about Halligan reaching out to her and starting a dialog about the Comey case all because Bower's retweeted a NYT article I knew this was going to get interesting fast. Halligan is not only insanely out-of-her-depth she's confident too. Hoo boy pass the popcorn.,figurative
Water gymnastics is not that beautiful or impressive of a sport I'm not saying I could do any of that because I can't but whenever I see videos of it from the olympics it just looks like curated thrashing in a pool with the occasional flip or whatever. I get that the pools are see-through so you can see everything happening below the water and the body control in such a deep pool is admirable but it doesn't change my mind. It's not an impressive or jaw dropping sport no matter how good a routine or group supposedly is…everyone looks like they're drowning and splashing around in cool swimsuits.,figurative
Federal judges block Texas from using its new US House map in the 2026 midterms,literal
Maybe negotiate a cease fire to allow people to vote? A ceasefire can be negotiated at any time. Russia refuses to sign one unless it is tantamount to a full surrender and de-militarization of Ukraine.,literal
Using the fork without a jabbing motion. Not that hard to understand guys scooping with a fork,literal
House Speaker Mike Johnson says Senate must stop the Epstein files bill,literal
Pope warns against escalating violence persecution of Christians in Nigeria,literal
Love the universe love the LOTR books and movies read the Hobbit a thousand times as a kid...the Hobbit movie trilogy is boring it makes me feel disconnected...it's just not good. That's not a comparison to LOTR. It's an opinion based on movies in general. Excellent for putting me to sleep when I'm restless though.,literal
After 'Disgusting Display' at White House Omar Says Congress Must Stop Trump Sale of F-35s to Saudis,literal
"Trump's greatest crime is practically invisible: Estimates show that the dismantling of USAID has killed at least 600, 000 to date. It could get much worse",figurative
Considering if Bondi is fired or resigned then Acting AG would be the Dep AG which is Todd Blanche who was Trumps criminal defense lawyer. So I am not entirely sold on this possibility though I agree they'll split hairs on something that everyone will know is total bullshit but the courts will have to entertain. Though if we're going to be imagining all sorts of things say this type of bullshit is done and finally the Republicans/MAGA in both chambers are like fuck it - we will impeach and convict you this time chomo! That would be nice.,figurative
The walmarts usually close down after a few years anyway leaving the area pretty much fucked,literal
Israeli figures warn state has 'lost control' as West Bank settlers attack,figurative
1) Gerrymander Blue. 2) Outlaw gerrymandering. 3) Waive goodbye to the GOP. 4) Put a kettle on.,figurative
His adopted son needs to monitor to make sure he doesn't have too much pleasure.,literal
I mean your analogy is more accurate but did you really expect people to type and explain all that? I like my analogy of two different families of different wealth and number of family members trading with each other. Those families represent countries. Some countries/families will eat more stew. Some will produce more stew. There will always be a trade deficit in some form because not all countries are equal. The grocery store analogy while not accurate is good enough to explain why complaining about a trade deficit is dumb.,literal
Trump's environmental policy is determined to make America poisoned again,figurative
Sounds like Dozy Donald has been calling Putin again …,figurative
Important to view this as a Witkoff plan until we know any different. It is not clear at this stage if Trump was even on board. In fact there are some indications he might not have been. Certainly hard to believe the adults in the room — Rubio Kellogg — were in the loop. Is Witkoff just an incompetent moron or is stirring the pot his job?,figurative
10 people died due to the Russian attack on Ternopil among 37 injured twelve are children there are people under the rubble - MIA,literal
China reclaims spot as top German trade partner from US,figurative
All while the Estee Lauder Companies lay off thousands. I know the family's personal wealth is not the same. But they also recently sold $1B in shares to cover estate taxes.,literal
Two Ukrainians working for Russia behind rail sabotage Polish PM says,literal
I've heard of higher energy photons from Startalk briefly. Is it possible there's a higher energy field moving so quickly that it's imperceptible? As if the speed of the universe is one boundary or shell and there could be more like an electrons shells?,literal
China in 'covert and calculated' effort to recruit MPs and peers minister says,literal
The Notebook has gotta be one of the WORST romantic movies ever The notebook is for those couples lowkey and by that I mean the couple that are AWFUL together but stay together bc arguing=passion and comfort=boring they also never stop complaining about each other to their friends the movie also sucks bc 1. She CHEATS on her fiancé day TWO 2. Lies about what she's doing 3. The guy sleeps around with a WAR widow and leads her on,literal
Zelensky Will Try to Revive Peace Talks With Russia During Turkey Visit,figurative
Ok yeah but look at it this way. If someone tells you This cake isn't good for you and then they procede and eat it in front of you how are you going to feel? That's basically what he did to his wife.,literal
Is your mom getting pushback from people maybe even her ex-husband? Because it sounds as if she was into it. NTA. Tell them that it's YOUR wedding and they're not the gatekeepers of tradition. If they don't want to do it the way you want then you will walk yourself down the aisle alone like in the Crazy Rich Asians movie.,figurative
US proposals to end Russia's war involve Ukraine giving up land some weapons sources say,literal
I think there's a difference between a Democrat who works with corporations and a corporate Democrat.,literal
Ukraine alarmed as US pushes peace framework aligning with Moscow demands,literal
Karoline Leavitt admits 32-year age gap with husband Nicholas Riccio is 'very unusual',literal
Japanese minister calls Dokdo (Liancourt Rocks) 'inherent part' of Japan after protests from Seoul over renewed territorial claims,literal
That is a truly unpopular opinion. The problem with the trilogy is that they added stuff that wasn't in Tolkien. It should have been two movies. One through Beorn the other from Beorn to the conclusion. We didn't need the elves turned into good guys nor the elf/hobbit infatuation.,literal
Reselling tickets for profit to be outlawed in UK government crackdown,figurative
Electric vehicle sales are booming in South America - without Tesla,figurative
What peace push ? Collaboration with war criminals for the best deal for them ?,literal
I mean this whole article is according to the IDF. So if you haven't trusted them before I'm not sure why'd you'd treat this article as fact.,literal
He's not confusing the two but he is also kind of wrong... Mussolini 100% started as a socialist; both of his parents were and he personally went so far as being arrested for his work in the Italian socialist party... [continues with historical explanation],literal
Oxford Union students mimic Ramallah lynching gesture during Israeli speaker's visit,literal
Networking events are honestly just exhausting ok so i've been to like 30+ of these things over the past 5 years and i genuinely think they're a waste of time. everyone's like oh you NEED to network but the actual connections i've made? maybe 2 or 3. that's IT. all my real professional relationships came from actually working with people on projects and helping people in online communities...,literal
Red onions should be called purple onions We need to find the person who first saw a red onion and said to themselves Hey I'm going to call it a purple onion. I don't understand how that's possible. Maybe they were color blind I don't know but we need to change the name of red onions to purple onions.,literal
Wrong kind of Nazis. Loomer appears to have no problem with fascism EXCEPT when it focuses on Jewish people.,figurative
What a shocking surprise from our former allies in America.,figurative
They ARE bad movies tho. So very very bad. Much less than the sum of the parts. LOTR was good. It didn't insert a bunch of unnecessary shit. It actually edited reductively.,literal
Please remember what subreddit you are in this is unpopular opinion. We want civil and unpopular takes and discussion. Any uncivil and ToS violating comments will be removed and subject to a ban. Have a nice day! I am a bot and this action was performed automatically. Please contact the moderators of this subreddit if you have any questions or concerns.,literal
Cruise ships are a terrible. I don't understand why people want to go on cruise ships you end up trapped on a floating hotel with a bunch of strangers and or screaming children and the worst part you can't just leave for a few hours to go sight seeing for a few hours like a normal hotel... Cruise ships are just a big scam that pray on the romantic aspect that was made by popular by the movie titanic...,figurative
UN Security Council adopts US resolution on Trump's Gaza plan,literal
Seems like you care about brands than most people lol,literal
First Subspace communication What are you wearing?,figurative
House Democrat pushing for release of full Epstein files predicts contents will 'shock the conscience of this country',literal
Indie games were never that great the only reason they are being so overhyped is because the industry is so bad that we don't have any option but to cope with these smaller titles Just play old games Indie games were never the standard in the industry we are only talking about them because there is no standard anymore. The dark age has come and so has the copium. Just play older games instead of trying to find some hidden gem nowadays.,figurative
Romania scrambles fighter jets after drone breach during Russian strike on Ukraine,literal
Action movies are way too boring Talking specifically about heavy action movies with hand fighting or car chases like John Wick Mission Impossible or The Fast and the Furious. Most of these movies are WWE for people who don't want to admit they like WWE. The choreography is usually pretty impressive but if you've seen one fake fight you've seen most of them. The movies that use action scenes in place of actual plot or an interesting story just don't appeal to me. Why am I spending 2 hours watching actors fake break windows and fight over guns that always have no ammo?,literal
'Completely normalized': MP condemns latest anti-Israel protest in Toronto's Jewish neighbourhood,literal
Russia demands Ukraine to reduce army and give up territory that it hasn't yet succeeded to invade. Sounds like something it can do by itself without any need from USA if it wishes to do so.,figurative
Poll: Democrats have biggest advantage for control of Congress in 8 years,literal
Also reminder. When you piss off the world to the point of causing war. Having trains that always run on time IS SUPER FUCKING BAD. Because guess what? That arms shipment or troop transport is probably gonna be at X spot between station A and B right about now. Be a shame if something were to happen to it right on time.,figurative
Well given that Reddit is mostly Russian bots now I'm probably leaving this site.,literal
Wiling to bet this has been scrubbed so hard that you can see through it.,figurative
Del deserved to be chewed out by Neil - Planes Trains and Automobiles So it's my yearly rewatch of PT&A and I gotta say I'm not shocked that Neil flipped out at Del...Del is an absolute nightmare and pushed all the right buttons to get the epic tongue lashing from Neil. Did Neil go to far? Sure but he's been with Del Griffith...and well you saw what he did!,figurative
Ukraine signs a letter of intent to buy up to 100 Rafale warplanes from France,literal
Sens. Schiff Curtis Introduce Bipartisan Bill to Create First-Ever Respiratory Protection Requirements for Federal Firefighters,literal
D&D is horribly boring. Maybe I'm just playing with the wrong groups or hell maybe I'm the problem. But D&D (and TTRPGs in general) are so mind-numbingly boring to me... But the second combat or a dungeon come up it's the most boring slog of all time. Hours upon hours to resolve seconds of combat waiting for people to look up from their phones and figure out what they're going to do...,figurative
Cans of soda for $2.5 at a restaurant? That is a steal! Im used to having to fork out $4-8 with no free refills! (Not USA).,figurative
Trump says he will approve sale of F-35 fighter jets to Saudi Arabia,literal
Penny Lane is better than Strawberry Fields Forever It seems to have become commonplace that while Penny Lane charted better SFF is the better song. Is it more innovative? Definitely. Does it sound weirder? Absolutely... But Penny Lane is absolute and utter pop music perfection. Not a note is wrong. The lyrics are magical and evocative. I listen to it and enjoy it more than SFF.,literal
SNAP benefits update: USDA to completely deconstruct program,figurative
James Comey seeks to dismiss 'selective and vindictive' case against him in key hearing,literal
Quantum teleportation between photons from two distant light sources achieved,literal
In my opinion Legolas is the worst part of the Hobbit trilogy. He feels shoehorned in and the editing done to de-age Orlando Bloom is bad at best. Adding him was entirely unnecessary and only took away from the story and added totally unnecessary parts. As others noted they really just added a bunch of stuff so they could make extra movies. All this did was cheapen the story make things more confusing and slow the plot down to a grueling pace,figurative
No he's saying it should be 91/11/5202. The 9 being the smallest unit (days) the first 1 being the next smallest (10's of days) then months then ten's of months etc. still stupid though because that's not how we right numbers,literal
Kash Patel always looks like he's surprised by the fact that he even knows how to breathe.,figurative
Popular Topics Mega-Hub Greetings you opinionated unpopular lot! This is your one-stop shop for all of the ridiculously reposted topics on this sub. This hub and the linked threads below will be replaced every 7 days to keep things fresh.,literal
'We have no choice': Indigenous guards take on cocaine gangs in Peru's Amazon,figurative
Democrats open up biggest polling lead over Republicans in eight years,literal
I was wondering that the ceasefire has been violated dozens of times. I feel like by definition it hasn't been a ceasefire since the first day.,literal
It's not multiple anymore. I've gotten older and I just can't keep up that masterbatory pace like I used to.,figurative
If only the mocking came before the election. Bit late now Rogan.,literal
Side punchout cameras are better than middle punchout cameras on phone screens... The middle punchout forces everything downwards while the side punchout allows for notifications and those icon things to be displayed at the top of the screen. No TV show or YT video has important stuff at the top right and left corners. The punchouts block everything and ruin the experience of a phone so much for such a tiny thing. Your screen real estate is effectively lessened.,figurative
Both DD/MM/YYYY and MM/DD/YYYY are equally as bad As a standard both are fine because the local population understand which 2 digits are month and day and it is identical to how the local language orders dates. The argument that DD/MM/YYYY is better because it's from smallest to largest is just wrong. It's actual order is 2nd smallest 1st smallest 4th smallest etc... YYYY/MM/DD is just much better than both.,literal
Epstein's Bro Sounds Alarm: GOP Is 'Sabotaging' Files Ahead of Release | Jeffrey Epstein's brother says his sibling definitely had dirt on the president—but he is unsure it will ever see the light of day.,figurative
Because proportionality is only for certain people it seems according to this brain rotted sub,figurative
The Republican party doesn't break ranks on anything. They must have finished doctoring or redacting the files sufficiently and ended the shutdown and allowed the vote because they're ready for release.,figurative
Massie on FBI DOJ leaders being criminally liable if Trump doesn't release all Epstein files,literal
German Chancellor Merz just wanted home Berlin says after Brazil remark irks Lula,literal
Do people think Smaug was the example of too much CGI in the Hobbit? That's not my impression. I thought he was seen as one of the best things about it. At least at first before the golden statue stuff. It's characters like Azog as compared to someone like Lurtz where the difference is noticeable in a bad way. Or the goblins vs the Moria orcs. They just look much more fake and the whole direction of the scenes more video gamey with little feeling of danger or tension despite the constant action...,figurative
I think that's up for debate. Again the world is going to eventually tire of giving money/support to Ukraine in a war that doesn't seem to be going anywhere. You might not like it but eventually they will have to choose to accept concessions or go at it alone. At that point they only really have one option.,figurative
It's never about peace. It's about pieces and how many can Putin acquire.,figurative
Ukraine corruption case causes stand-off in parliament as anger mounts,figurative
