text,label
Jeffrey Epstein's Brother Claims He Heard 'from a Pretty Good Source' That Epstein Files Are Being Scrubbed of Republican Names,literal
TV shows would do better if they were more like the Andy Griffith Show and similar programs Because when I look at TV shows today it's nothing but violence cuss words and the characters being very mean-spirited to each other. When I look at Andy Griffith I see friendliness no cussing good humor good music and the show exists for the sake of entertaining people.,literal
The rye chips in Chex mix are the worst part Their texture is too hard and they taste like burnt toast. Idk why people like them and so much so that they actually created an entire new line of just rye chips. Whole bags of rye chips for people to munch on...,literal
I dont wanna be that guy but...music in video games breaks my immersion I have been playing Abiotic Factor a game that is much like Half Life/Black Mesa. I never played those games with music. Same with Outlast just no music. I don't get scared or spooked if music is on. Although what i do like to hear is the ambient sounds...the environment...,figurative
Didn't China do this last year to the Phillipenes and everyone got pissed?,literal
nope.... we as a society can judge. It's not healthy. Its fucked up. its gross. she has daddy issues.... we can judge her for it. We can judge men who like these kind of relationships too.,literal
I hope they screw this up royally somehow and he spends the next 3 years embroiled in scandal and litigation on thos issue instead of enacting all the stuff they want to do.,figurative
Please remember what subreddit you are in this is unpopular opinion. We want civil and unpopular takes and discussion. Any uncivil and ToS violating comments will be removed and subject to a ban. Have a nice day! I am a bot and this action was performed automatically. Please contact the moderators of this subreddit if you have any questions or concerns.,literal
Ramen noodles should include broth If a customer goes to a restaurant and order a side of ramen noodles they should receive the noodles AND the broth. Not just some dry noodles...,literal
Immigrants Unlawfully Detained by ICE in New York to Receive Over $100 Million in Compensation,literal
Not taking a lunch break isn't a flex it's poor time management. This is specifically directed at people in the office who brag about being soo busy they don't have time to take a lunch break. Bonus points if they're passive aggressive towards you for taking your break. It doesn't make you sound like a hard worker it just sounds like you have poor time management skills.,figurative
I doubt if many people in Ukraine expects to get that territory back in the near future. They would accept a ceasefire if the terms recognized the lost ground as still belonging to Ukraine but any proposal that cedes it to Russia is a non-starter. They MIGHT agree to give up claim to the territory if they also were made a NATO member at the same time. But that's not happening.,literal
Apparently it is so complicated that it cannot be audited.,literal
Wedding speeches are cringe factories and need to die I was best man last June. The groom's dad went full karaoke into a mic that wasn't even on for five minutes. I still taste the secondhand embarrassment. Then the maid of honor read a poem about the bride's dead cat. People cried for the wrong reasons. I drank my water glass like it could erase sound. We clapped because we felt bad. That's not love it's hostage negotiation with cake. Let couples text their thanks and spare us all the sweat.,figurative
This is my complaint about any episodic streaming show on hulu/netflix or whatever. There's enough there that it would be good if it was like one... maybe two movies instead of a bunch of meaningless fluff in between. Movies can be great precisely because you cut stuff down.,figurative
Same for Israel's current administration. Both suck pretty horribly and toy with civilian lives,figurative
Yes. I am transitioning. We can do that right? How am I not arguing on good faith? If the guy came up with a litany of reasons then yes sure I would've been like OK that makes sense. But his answer just raised more questions. Seriously it sounds like you are not arguing in good faith. To prove my point let's do some math. Let's say he has 100 interim staff he needs to pay for. That's a ridiculously huge number but just for the sake of argument all allow it. 100 staff members needed before January is 0.002 percent of the amount of resumes he's received. Are you really suggesting that he should not use AI to disqualify the resumes that clearly do not meet requirements? Because doing so would bring that number way down to a reasonable amount that you can vet by hand. If that's the case that alone proves you are not arguing in good faith.,literal
US colleges see 17% drop in newly enrolled international students report finds,literal
The trend of calling everything slop is lazy and stupid. It's like the next evolution in a trend of just bunching everything you don't like into some category defined by a word. First things you didn't like you'd say that's gay then everything you don't like is cringe now everything you don't like is just slop. Is it that hard to just express why you don't like a thing give your perspective and *gasp* listen to people who don't agree?,figurative
So the plan is for Ukraine to give up some of its land and shrink the army and their ability to fend off another invasion? This is a plan to embolden Russia and to give them an edge when they invade Ukraine the next time.,figurative
he is just such a bad Politician. He makes the most unforced of errors for no reason what so ever. Moves himself into any corner he can find and pisses of even his own party.,figurative
The writing is of the same quality as Lotr. And the same adaptation methods. The script pacing themes and adaptation are not developed to nearly the caliber of the Lotr movies. Tauriel oh boy god forbid they want a female presence. JFC dude this is a terrible straw man and you know it. She exists solely to facilitate an unnecessary and poorly developed love triangle. Look man they're not bad movies and the internet can as a rule always benefit from a few deep breaths but most people would agree that there's a clear difference in quality between these two trilogies...,figurative
School Bus Stop Tickets are more about generating revenue than safety in my county there are school bus stops that are known as ticket generators - using cameras to autoflag drivers. the judges even acknowledge that they get several per week or even day from the same stop if you go to fight it. if there is a bus stop that is generating multiple tickets per day or week (which there are in many locales) at that point it's the county deciding to put kids at risk to generate revenue.,figurative
Weren't they trying to pretend the all the red hand pins they're wearing aren't a reference to the Ramallah lyching but some other 'symbol of resistance' that just happens to look exactly the same? 🤔,figurative
Russian spy ship pointed lasers at RAF pilots tracking it says UK,literal
Australia's eSafety Commissioner called to testify before US Congress and labelled a 'zealot',literal
Funny the US convinced them to give up nukes and pinky promised they'd have Ukraine's back if russia took advantage. Wonder how that worked out…,figurative
Donald Trump tells reporter 'quiet Piggy' when asked about Epstein files,literal
This. Why is Google plugging the same b.s. article (posted by different sources) lying about IRS confirmation of Trump's $2k stimulus? Yesterday my Chrome homepage suggested this link and today it's been recycled with a new source. A quick search of IRS.gov comes up empty so are they complicit in the White House's deception?,figurative
Fetterman can't realistically run as a Republican. In a GOP primary they never vote for GOP-lite. There would be multiple MAGAts running to his right and one of them would win the primary. Fetterman's senate career will finish after 1 term because he could not win a Dem primary either.,literal
The Charlie Kirk purge: How 600 Americans were punished in a pro-Trump crackdown,figurative
Fuck no lol it's not remotely good. Tolkien rolled in his grave when Hollywood shit that thing out You can like it. That's fine. But as a piece of the LOTR universe it breaks so fucking much of the lore it objectively is not good LOTR content.,figurative
Majority of corporate Trump ballroom donors represented by 3 lobbying firms watchdog says,literal
This guy is a fucked up vile human being. He's mentally ill and has been for decades. He needs to be placed in a psychiatric ward.,literal
MI5 spy agency warns Chinese agents are trying to recruit UK politicians on LinkedIn,literal
Truly weird timing if anything now that the Epstein files will inevitably be released you would think pootin grip on trump has been rendered useless (trump will say those evidence videos are all AI case closed). So why trump is still catering to pootin is just beyond me,figurative
This submission has been removed as your elaboration was less than 160 characters (roughly two or three standard sized sentences). If you wish to resubmit the post make sure you include an elaboration/explanation to your post that is has more content. Please read Rule 1 and the rest of them while you're at it. Note that Reddit's character count is unreliable as they count spaces whereas I'm programmed to not count spaces and there's nothing the mods can do about it. I am a bot and this action was performed automatically. Please contact the moderators of this subreddit if you have any questions or concerns.,literal
Trump Says He Will Approve the Release of the Epstein Files. But There Are Loopholes.: The bill has not yet been presented to the president and it wasn't clear when it might reach his desk.,literal
Death toll from Russian airstrike on Ternopil in western Ukraine rises to 25 including children,literal
Any country doing business with Russia will be 'very severely' sanctioned: Trump,literal
instead of being upset at Israel for using the cluster munitions perhaps be upset at Hezbolla for attacking Israel in the first place. While one may believe whatever they want about the legality/morality of Israel's use of these weapons they would not have been used if Lebanon (and the UN) hadn't let Hezbolla setup a mini terrorist state in south Lebanon and use it as a base to attack Israel.,literal
Ukraine Confirms ATACMS Strike on Military Targets in Russia,literal
Joy Cons should've revolutionized controllers They may have not been perfect with weird flat non ergonomic design cheap plastic feeling and the obvious stick drift but just the option to move my hands freely without holding them tightly and stiff together is a godsend. They make gaming for longer sessions so much more comfortable when I can just relax my arms. Other consoles should've catched on and at least created their own options of this maybe even have driven it further to perfection,figurative
Ex-Trump WH lawyer Ty Cobb blasts Comey case: 'Both Halligan and Bondi should be disbarred',figurative
Pope strongly backs US bishops in blasting Trump immigration crackdown urges humane treatment,figurative
Nearly all immigrants detained in Trump Chicago raid had no criminal conviction,literal
Japan warns citizens in China about safety as diplomatic crisis deepens,figurative
Maybe they´ve sent Ukraine a box with Not Taurus written on it where totally random parts for a new missile will be contained and will totally not be a Taurus once you put them together.,figurative
It's a built in excuse when they inevitably don't send it out,literal
They exist in ceasefires and they exist in wars. The only time you ignore proportionality is if you believe the other side is less than human historically.,literal
US to designate Venezuela's Cartel de los Soles as terrorists,literal
NYC Mayor-elect Zohran Mamdani asks for donations to help cover $4 million in transition expenses,literal
Texas Republicans started a national redistricting arms race. They may be losing.,figurative
Canada's Oil Sands Make Their Comeback as US Shale Plateaus,figurative
Cloudflare outage causes error messages across the internet,literal
Senate unanimously votes to send bill demanding Epstein file release to Trump's desk,literal
Hit dogs holler…or they seethe with rage and vow retribution against anyone who exposes them. The dog that didn't bark...,figurative
in other news the Trump administration is expecting a large number of donations for trumps ballroom to come in the next 20days. They ask that you give them at least 10 days to redact your name from the Epstein files,figurative
Don't worry they will F it up in time for elections,literal
Lawmakers want to let users sue over harmful social media algorithms,literal
Top Italian court approves handover of Ukrainian Nord Stream suspect to Germany,literal
LGBTQ+ Mega Thread Please post all topics about LGBTQ+ here,literal
Early Greek repayment gives France surprise budget boost,figurative
Saab can match U.S. F-35 deal for Canada: Swedish deputy PM,literal
Ukraine alarmed as US pushes peace framework aligning with Moscow demands,literal
Pink Floyd is mid Not only are they not one of the best rock bands they are not in the top 5 of british bands. Barely in the top 5 for prog. Drugs. That is what makes this band interesting to people. It seems like everyone who champions them has had their mind altered by taking acid or a copious amount of weed. One shouldn't have to disturb their brain chemistry to get into them...,figurative
Zelenskiy meets Turkish president as word emerges of new US peace push,literal
The Hobbit Trilogy is perfectly fine No its not the Lotr. If you expected it to be that's your own problem. Going into it thinking you were going to experience watching Lotr for the first time again is what ruined it for many of you...,literal
Realistic alternative involves Ukraine making its own decisions not strongarmed from the US with a deal the US chose.,figurative
It would be a shame if a bunch of angry Ukrainians mysteriously appeared and did something to it and then vanished just as quickly as they appeared,figurative
Acquiring and driving an old car is better than doing so a new car. I drive a '92 VW Jetta been driving it for the past 5 years. Got it for cheap spare parts are easy to find mechanically easy to fix car is simple has style does what is intended to do: get you from one place to another. People just don't want to deal with others criticising their old raggedy bucket overall worried about what others may think of them. Financial stability >>> keeping up with societal norms,figurative
Germany confirms long-range missile delivery to Ukraine amid strategic shift,literal
Completely agree I don't care what anyone says I like that there is more LoTR media and ok the story isn't the best sometimes but it's well-made and visually amazing. Plus anything that has more Galadriel will never get complaints from me.,literal
Porsche is an ugly duck-looking car They have an ugly long duckbill hood. It'd be nice if I could like it and not unwillingly gag in disgust whenever I see one but they're just so damn ugly. Because of their long hood it just looks like an ugly duck.,figurative
Canada geese aren't scary and people who make a big fuss about them are crybabies But they poop on my golf course :( IDK DUDE geese love water and are grassland foragers—don't construct the perfect habitat for them and be mad when the homies roll up. But they're bullies when I feed the ducks :( taps sign Don't feed the wildlife bro. Get outta here with your bread—it ain't good for birds anyways?? They're CUTE and CHARMING and their bites DON'T actually hurt at all.,figurative
Sanctions Choke Off Russia's Oil Flow to China—Crude Imports Nosedive 66%,figurative
Dutch government suspends intervention into chipmaker Nexperia,literal
None of this screed addresses the notion that Europe is one of the major sources of funding for Russia's war in Ukraine and that they've failed to rise to the threat of Russian revanchism. I wasn't addressing that notion. You wanted me to address that notion because you think you can somehow argue against that with uhm well we technically spend a couple billion more on oil than on Ukranian aid. Checkmate! when that has been frequently explained by the fact that a) purchases of Russian resources have diminished by sometimes as much as 90% compared to pre-war levels and b) the remaining 10% of purchases are only waht is necessary so Europe has the manufacturing capacity to actually continue supporting Ukraine. The remaining 10% are scheduled to run out in 2027 and the only one who will still keep importing is Hungary cause we know Orban sucks Putin's dick. Literally a ton of the support necessary for your statement to work is that yes two countries in Europe are Putin stooges so we know they do and will continue to buy resources. That doesn't invalidate the 90% drop compared to pre-war levels and the complete phase out. You can complain all you want about Trump (and fuck that guy all the way to the sun) but if Europe had been pulling its weight since the beginning of this and actually showed some real goddamn initiative Trump wouldn't matter. We've been consistently supporting Ukraine more than the fucking US throughout mid-2025 to the tune of 10-20% more and the only reason Americans even go back on this shit is because while they deliver weapons directly and inflate the worth of 20 year old equipment we directly pay premium for these weapons. America has taken a rocket worth a million in 1995 slapped a $1 million price tag on it in 2025 and sent it over to Ukraine at a premium while the MIC re-stocks the American capacities. I know it's something Americans don't like to hear but even fucking Biden slow-trickled the aid deliveries and inflated the numbers to give the MIC more profit. You're a polity of 500M people demanding that a nation of 330M people save you from a nation of 120M people I don't demand shit from you.,figurative
So just to clarify your response to: I think it's reasonable to allow myself just one thing for my own sake and do that my way even if my girlfriend wants otherwise. ... Is that he's an asshole for wanting this?,literal
More Trump BS … and the can continues down the road …,figurative
Ukraine has never been an ally stop trying to push this. The west is just backing them to get at Russia and nothing else,figurative
Yes but people expect better than fine as they should when it comes to Tolkien Peter Jackson and his adaptations. They don't expect 74 marvel sequels,literal
Poll shows Democrats with biggest generic ballot lead since 2017,literal
The best Reese's are the minis There. I said it. Not everyone likes peanut butter that much and Reese's actually made me despise peanut butter more. The mini ones are perfect with a balanced ratio of chocolate to peanut butter. That is a candy. If you want peanut butter then just eat peanut butter. I am pretty sure that Reese's sells their peanut butters in jars too.,literal
Are these the five women who could bring down Donald Trump?,figurative
This article is weak. The actual bill says... [long quote of bill text] ...They doubled her homework if she redacts.,figurative
Open Season is genuinely a great movie Say what you want about the sequels but nostalgia aside the first Open Season movie is overhated and it's way better than it gets credit for. It's a simple story with a good message the early 2000's vibe even some emotional moments and beautiful animation for the time. Let's not forget that it's a Sony film first animated one at that and well... Sony doesn't exactly have a good track record they're only sometimes able to make a good film but that was a really good start and a classic childhood film for many people.,literal
Russia's flagship oil price drops as buyers retreat ahead of US sanctions,figurative
Donald Trump's White House ballroom targeted in new bill,literal
Argentina's annual inflation falls in October to lowest since mid-2018,figurative
Continuing to kick the can down the road... gotta try to stop this disaster from impacting elections and all.,figurative
So they have to give up land and weaken their defenses against being attacked like this again. Yup. Sounds like a Trump deal.,figurative
This is one of those popular unpopular opinions. Most people don't really care one way or another. If their clothes have brands/logos on them. It's incidental mostly. Then there's the folks that DO care about logos and brands which is who you're talking about. They're not really a majority they just happen to be noticeable. Then there's the folks that are the opposite and refuse to buy something with any branding on it....even if it's an otherwise quality product at an otherwise reasonable price. So I don't really think it's unpopular or popular...it's just most people don't really even have much opinion beyond being aware of it.,literal
Not sure where you got any of your information but it's basically all false. AI is so much more than just LLM companies trying to sell you a chat bot. Every single sector of the economy is integrating AI into it. I've been designing and building supercomputers for a very long time and this AI craze is nothing new it's not unique at all. Like I have mentioned in other replies every single sector is using AI in some way or another right now with huge success. Everything from the hyperscalers and tech giants all the way down to grocery stores and gas stations. HPC has been around for a long time and GPU's were slowly adopted over decades with recent advancements in software exploding the usefulness of CUDA and other similar alternatives. Machine learning finally hit a critical mass to be broadly applicable in every single sector... it's not gonna go away unless something better replaces it.,figurative
Sports gambling isn't that bad and is unfairly vilified. I get it gambling is in general bad the house always wins. Most people will net lose money. The adds are annoying and everywhere... But you'd think Fan Duel personally stole everyones first child... I know more people who've ruined their life on the stock market then on a Sportsbook. But no one wants to abolish brokerages and ban Robin Hood in their state...,figurative
Macron Announces Joint EU–US Effort to Curb Russia's Shadow Fleet and Oil Revenues,figurative
Would kill for a limited series or movie just about the Witch King,figurative
Boost to warfighting readiness as Britain's aircraft carrier fully 'mission ready' and committed to NATO for the first time,figurative
We need to change the term conspiracy theories to conspiracy hoaxes I feel like using the definitions for the words conspiracy and hoax will hopefully back up my argument: A theory is a scientifically acceptable or plausible general principle or body of principles based on facts A hoax is a plan to deceive someone. We should use the term conspiracy hoaxes because half of these are just built to deceive and lie to people about history about politics about literally anything.,literal
Madagascar Leader Finds Huge Emerald in Presidential Palace,literal
Muslim Brotherhood siphons funds from Gaza donations,figurative
Thankfully he is. It's just that his best aren't very good.,literal
west Taiwan still upset that other countries have their own territory. careful you might crash again,figurative
It's my lack of faith. These people are too stupid to switch to a better alternative for their evil causes. They will need some kind of clown or famous rapist or some guy that shot a black guy or something to rally behind,literal
Ocasio-Cortez Says 'We Should Not Be Entertaining a Bailout' of AI Industry as Bubble Fears Grow,literal
I'm a people pleaser Is just a less humiliating way of saying I'm spineless Title. Whether it be online posts or IRL self descriptions of behavior its just a way to admit you're a coward without having to use such obviously humiliating language to describe yourself.,figurative
This submission has been removed as your elaboration was less than 160 characters (roughly two or three standard sized sentences). If you wish to resubmit the post make sure you include an elaboration/explanation to your post that is has more content. Please read Rule 1 and the rest of them while you're at it. Note that Reddit's character count is unreliable as they count spaces whereas I'm programmed to not count spaces and there's nothing the mods can do about it. I am a bot and this action was performed automatically. Please contact the moderators of this subreddit if you have any questions or concerns.,literal
Gaza water provider suspends services after Hamas detains staff member,literal
Politics Mega Thread Please post all topics about politics here,literal
Yes because the age of my newly made Reddit account really takes away from my valid & accurate point. Go be a bot elsewhere the adults are talking.,literal
Thirteen people killed in Israeli strike on Lebanon's Sidon Lebanese health ministry says,literal
Zelenskyy faces pressure to fire top aide Yermak amid corruption scandal,figurative
'No easy options': Von der Leyen urges EU countries to plug €135bn gap for Ukraine,figurative
Trump Family's Business Ties to Saudi Arabia Raise Ethics Worries: President Trump will host Crown Prince Mohammed bin Salman Saudi Arabia's de facto ruler who oversees a major construction project that is in talks with the Trump family business.,literal
Working Families Party to support challenger to John Fetterman,literal
