text,label
Mossad unveils network of Hamas terror infrastructure across Europe — According to the Mossad coordinated raids in Austria and Germany resulted in arrests and the seizure of weapons and explosives intended for use on command.,figurative
Hamas rejects UN Gaza resolution says international force would become party to conflict,literal
Churu cat snacks are wasteful They're going to be the K cups of our time. Using a little bit of waste every time you want to give your cat a treat is a lot of unnecessary waste that is clogging up our already overburdened waste system...,figurative
In the small town of Jemison Alabama there have been ongoing ICE protests.,literal
Logos are usually put on brands that (used to) make decent clothing to let you know that you can expect a certain level of quality from that garment.,literal
Then what makes you a good person? The point of being s good person is doing what YOU can do to cause good and for some people donating IS their way of doing good,literal
Mark Epstein: 'Jeffrey definitely had dirt on Trump',figurative
Fumbling a ball out of bounds in American football should be a turnover. In other sports like soccer and basketball if a team loses a ball that goes out of bounds the other team receives the ball. In football the team that fumbles receives the ball unless the fumble occurs in the endzone only then it's a turnover. This would make fumbling consistent no matter where it goes out of bounds.,literal
I'm English so yeah. I think Andrew should face charges and I think law enforcement should be pursuing them but they won't. He only had his title and residence stripped because the royals are trying to distance themselves from him.,figurative
Polish PM says railway track blast was 'unprecedented act of sabotage',literal
that's okay. Because no matter what at the end of the day at least one person is receiving love from these kind gestures. This is so obvious and yet so many people miss this thank you.,figurative
These aren't school photos why are you talking about them? We're talking about proposal photos. Although even for school photos the answer is usually yes you can get digital versions of those photos and probably should in 2025.,literal
It's because you talked about how expensive the proposal already is for you,literal
As a reminder this subreddit is for civil discussion. In general please be courteous to others. Argue the merits of ideas don't attack other posters or commenters. Hate speech any suggestion or support of physical harm or other rule violations can result in a temporary or a permanent ban. If you see comments in violation of our rules please report them. Sub-thread Information If the post flair on this post indicates the wrong paywall status please report this Automoderator comment with a custom report of incorrect flair. Announcement r/Politics is actively looking for new moderators. If you have an interest in helping to make this subreddit a place for quality discussion please fill out this form. I am a bot and this action was performed automatically. Please contact the moderators of this subreddit if you have any questions or concerns.,literal
Prince's songs did not age well and I feel like he isn't as legendary as he is considered I've been listening to tons of music lately all of prolific artists that are considered legends today like MJ The Beatles Marvin Gaye and Prince. I'm a huge fan of all of those artists besides Prince maybe you just had to be there to really understand it. His singing is okay and I know he is a legendary guitarist so wont contest that. Songs like 1999 and when doves cry idk his vocals just take me out of it and just don't sit well...,figurative
Admit your mistake by calling them and asking for forgiveness. This is important to your finance and his relationship with a good friend. Your reasoning is too rigid.,literal
Papyrus shouldn't be the norm for cards and gift wrapping bring back the good old greeting card companies Stores used to have lots of options for cards cute cheap paper average paper funny etc then the high end papyrus brand section if you wanted yo make a statement. Now it's only the papyrus brand and it's beyond ridiculously priced...,literal
U.S. trade deficit drops 24% in August as Trump's tariffs reduce imports,literal
Do people think Smaug was the example of too much CGI in the Hobbit? Also not sure where they'd find a real talking dragon......,figurative
Drone strikes Turkish tanker in Ukraine's Odesa where US natural gas will go,literal
Before being elected the first time Trump claimed he could solve terrorism but didn't want to say how without being elected. He finally caved in an interview and his answer was murder the terrorists' families. Terrorist don't care about themselves but they care about their families. When elected he removed restrictions on drone strikes that avoided killing civilians and stopped reporting when they killed them. and then there's the blowing up suspected drug boats thing. Kill everyone despite no imminent danger. It should be illegal if it isn't but it also shows he'll kill people as a preference not a last resort. MAGA is about protecting MAGA. He only refers to his opponents with extreme terminology so that if he has the opportunity he can declare them terrorists so he can go to town.,figurative
Donating money doesn't make you a good person A lot of time I have seen people defending celebs and influencers by saying They do a lot of charity. I don't think charity makes you a good person. Charity is like investment to them. It just to make themselves look good and make money. They don't really give a shit about anyone. Secondly If someone is earning 2-3 million a year then donating like 1% of your income to charity doesn't mean shit.,literal
In any case no information is traveling faster than the speed of light so why not just use regular light communication for information transfer? I mean this is all very interesting but nothing about it is practical in terms of sending information anywhere. Maybe for special cases like encryption or something?,literal
Comey to argue vindictive prosecution by Trump warrants dismissal,literal
Trump's disapproval rating hits worst point for second term: DDHQ average,figurative
Schumer says Trump DOJ can't 'f*** around' in releasing Epstein files: 'I don't trust Bondi',literal
People however should always be skeptical of any highly politicized intelligence agency's claims.,literal
Not taking a lunch break isn't a flex it's poor time management. This is specifically directed at people in the office who brag about being soo busy they don't have time to take a lunch break. Bonus points if they're passive aggressive towards you for taking your break. It doesn't make you sound like a hard worker it just sounds like you have poor time management skills.,figurative
DOJ admits full grand jury never reviewed final Comey indictment further imperiling case,literal
They exist most people just think they look hideous.,literal
Furious progressives swarm Schumer's job as Democratic leader,figurative
As corruption scandal hits Zelensky's party lawmakers side with opposition demand answers powers,figurative
Kleenex sucks and there is no reason to use them Kleenex is one of the most unnecessary brands out there. Their tissues are thin dissolve immediately are not particularly soft and not exactly cheap. Overall there's so many superior tissue brands that I wonder why Kleenex is even still popular.,literal
An egg scramble made with omelette ingredients is better than an actual omelette When you make an egg scramble with ingredients of an omelette the filling gets dispersed throughout and the ingredients are evenly distributed throughout the dish during preparation. I also prefer the consistency as opposed to having a bunch of omelette filling in between two layers of egg. Bonus points for cheese lovers in scrambles too because the cheese can melt all throughout the scramble and makes it all that much more delicious.,figurative
They put ads in my $139 prime membership to help fund those budgets… arguably they are spending my money/time depending on whether I pay $36 a year more for no ads or spend my time watching the ads.,literal
Parasocial is named as Cambridge Dictionary Word of the Year,literal
Oof. I hate them so much. An absolute blaspheme against a great story. Have an updoot.,figurative
Russian Neo-Nazis Group Launch Photo Contest With Killed Ukrainian POWs,literal
Traditional theatre is better than musical theatre I get the appeal of musical theatre really I do. However traditional theatre is not only more accessible to actors and performers physically and logistically but designers can get creative with the staging...,literal
Well the US/NATO are the ones propping up Ukraine's ability to wage war Oh no they give Ukraine weapons to defend themselves against murderers and rapists. How terrible of them. but they are in the advantageous position unfortunately and likely see no reason to throw away their ill-gotten gains Hence why many democratic nations around the globe are supporting Ukraine so they can sustain the fight and make it so costly for Russia to continue that they give up.,figurative
Media literacy isn't dead; it was never alive There's this quite clearly uncritically accepted idea that media literacy is dead because people can't parse the media they watch or listen to or read. But here's the thing: I think in the best days of the past most people couldn't parse the media they watched listened to or read... Media literacy couldn't have died because most people have never had the capacity to be media literate. Conversely today more people than ever have that capacity and simply choose not to be.,figurative
No because one man in a trench makes no difference compared to the the entire arms and logistics network of NATO It's a false equivalence because you're comparing a drop of water falling into the ocean vs fucking Chicxulub,figurative
People bitch and moan and moan and bitch that movies based on books don't tell the full story. Then you give them THREE movies based on ONE book and they bitch and moan and moan and bitch that it's 3 movies. Do you people want every last detail of the book in the movie or not?,literal
I'm willing to bet that even after redacting Trump there will be other names that will sing about Trump's guilt and they know this.,figurative
US holding secret peace talks with Moscow to end Russia's war against Ukraine Axios reports,literal
$5 per prints. $20 lunches. $200 books. $1600 a month rent. $50000 tuition. Nah dawg. I'll just go to my local uni for free.,literal
Cycling is better than walking or running Cycling is way better than walking or running. I don't get why people torture themselves when bikes exist. It's faster more efficient and way easier on your joints. You can cover long distances without feeling completely drained get places quicker and still get a solid workout. Plus its actually fun wind in your face sense of freedom no endless pounding on your knees or feet.,figurative
Ukrainian Foreign Minister Sybiha: Russians' Support of War Crimes – More Enthusiastic Than Nazi Germany,literal
Marshall Islands Launches Nationwide Universal Basic Income Program Using Digital Infrastructure,literal
He was doing it because Cheney was ex vice president of Haliburton and secured a 36 billion dollar contract out of them it's also quite strange that the Pentagon announced like a week prior to 9/11 that they were in debt something to the tune of 4 trillion dollars and then the part that gets hit just happens to be where the financial records are. There's also ample evidence his administration knew 9/11 would happen and didn't take action. Whether we blame Bush or not his administration was absolutely foul and likely stamped the death of thousands of people. Trump is a monster far worse but if we lose context on the evils of the past we aren't really learning from our mistakes as a country,figurative
The watermelon jolly rancher tastes disgusting The watermelon Jolly Rancher tastes downright unpleasant. Instead of the bright refreshing sweetness you'd expect it comes across as overwhelmingly artificial almost like you're tasting a burst of harsh chemical flavoring. Compared to the other Jolly Rancher flavors which tend to be much smoother and more enjoyable the watermelon one really stands out in a bad way.,literal
Confronted with Epstein question Trump takes aim at ABC's broadcast license,figurative
Trump 79 Launches Self-Soothing Posting Frenzy After Epstein Humiliation,figurative
It's a good way to transport quantum information which quantum computers use. The problem is useful quantum computers are 20 years away just like they were 20 years ago.,figurative
Homelander is NOT a funny character and he has no sense of humor I've heard some people say that they find Homelander from the Prime tv show 'The Boys' funny and they actually laugh at some of his scenes. I don't get it. He's never cracked any actually jokes with a punchline in all the seasons of The Boys so far...,figurative
Trump officials announce $1bn loan to restart Three Mile Island nuclear plant,literal
Fraud reports hit 13673 with losses reaching NT$6bn - Taipei Times,figurative
Over 30000 Charlotte students absent from school in protest of ICE operation reports say,literal
Stephen Curry has surpassed LeBron James in the GOAT debate Obviously Jordan will always be #1 and Kobe...well because he died his legacy is heightened but Curry is objectively next on the list. Sports fans are always going on about how much tougher sports are today compared to decades ago. Look no further than the Olympics where records are broken every few years. Well by that logic Curry's 4 titles > LeBron's 4 titles.,literal
Russian drones strike Ukrainian public broadcaster newsroom in Dnipro injuring two,literal
A Washington humiliation leaves Trump more politically exposed on Epstein than ever before,figurative
Russia can Never be trusted.. For the last 1000 years Russia has invaded neighboring countries stolen the land and brutalized the populations. Russia is a cancer.,figurative
Trump threatens ABC News broadcast license after reporter asks about Epstein,literal
Trump quote about bathrooms and water pressure during McDonald's speech is authentic,literal
Trump and MTG's Breakup Goes Far Beyond the Epstein Files,figurative
Saudi Journalist's Widow Slams Trump Shrugging Off His Horrific Murder,figurative
I'd call it the dot com bubble with a bit of Beanie Babies in it and a bit of the e and i era of prefixes. Lots of spending on what could be not will be and throwing money at it if it whispers AI while putting AI in every name or product to make it look new and cutting edge. While the actual products will probably die and any surviving ones will rebrand.,figurative
AI is good at cranking out cheap quick filler art for when you don't really need it to look good.,figurative
The best Reese's are the minis There. I said it. Not everyone likes peanut butter that much and Reese's actually made me despise peanut butter more. The mini ones are perfect with a balanced ratio of chocolate to peanut butter. That is a candy. If you want peanut butter then just eat peanut butter. I am pretty sure that Reese's sells their peanut butters in jars too.,literal
well sadly Russia israel and ukraine does it currently,literal
Officials death figures from CDC is -1.1 million deaths. 70% of the 1.1 millions deaths happened during Biden tenure That's the reason the media doesn't bring it up,literal
'We Ain't Buying It': Pro-MAGA monopolies targeted for holiday boycott,literal
Why all the Epstein files may not come out even though Congress took action,literal
Well yeah? That's what my initial comment said almost word for word? That gendered difference is 100% what it is because men look different than women. Women's styles are also normally different than mens. It is what it is if you want to call that propaganda then sure. But when it comes to suits (that's what this is about) I stand by my comment. Not everything has a deeper meaning or source. This is the kind of bs arguments that make conservatives look at us like nutjobs.,figurative
Indiana Professor Removed From Class Over White Supremacy Lesson,literal
Nigeria: Parents anxiously waiting for the release of kidnapped schoolgirls,literal
Obamacare tax credits look likely to expire as Trump rules out an extension,literal
Completely understandable and it sucks what the US has done the past 11 or so months to our neighbors to the north. I'd like to add that I've visited Quebec twice in the past couple of months and both were great trips. Everyone I met was incredibly nice and helpful. Like over the top nice compared to what I run into here in the US. So it seems the hatred is directed at the US government and not US citizens visiting Canada which was appreciated.,literal
I think everyone saw this coming whether out of incompetence or maliciousness or both but even as a cynic I expected a little more skill and preparation than this. Comey has an all star legal team but this glaring breach of procedure seems like something a public defender would've caught.,figurative
South Africa to refuse charter flights of Palestinians over fears of 'cleansing agenda',literal
yeah it feels like it takes insanely long to shop for something that lasts because you have to sort through thousands and thousands of branded slop.,figurative
The same day as his Epstein humiliation in the House Trump rages at media's questions while sitting next to Saudi crown prince,figurative
Jeffrey Epstein files vote expected to win near-unanimous backing in House,literal
This is only good news if exports stayed the same or increased. Every headline I have seen says foreign countries are just finding new sources for their goods and Americans are suffering.,literal
US Warns South Africa Not to Issue G-20 Statement at Summit,literal
Yes. The entire foundation of the Pro-Palestinian movement is the violent hatred of Jews. You don't attack Jews Synagogues Holocaust museums etc. in Europe Canada Australia the US etc. if your issue is with the government of Israel and how it's handling a war started by Palestinians. The fact that these people target Jews who have nothing to do with Israel or the war proves it's about hating Jews and anti-Zionism is just the new Antisemitism dog whistle.,figurative
Judge orders Texas school districts to remove Ten Commandments displays in response to new lawsuit filed by families,literal
She's a member of congress. She's absolutely one of the people that would decide.,literal
She knew that already what she just figured out is that all women includes the one she actually cares about.,literal
NYPD Commissioner Jessica Tisch accepts Mayor-elect Zohran Mamdani's offer to stay as top cop,literal
'Humiliated' Johnson Fumes as Epstein Files Saga Blows Up in His Face,figurative
I agree. They range in the 7-8 out of 10 range but get compared to perfect 10s so they look worse by comparison.,literal
Trump to sign Epstein bill 'whenever it gets to White House': Official,literal
Secret Tape That Could Spin Trump Into Another Cover-Up Scandal,figurative
One of 25 abducted students in Nigeria escapes as the search continues for the missing girls,literal
Gunmen abduct 25 girls from a Nigerian high school and kill one staff member,literal
The Germans specialty in the scientific endeavors was never engineering but chemistry TL;DR - Analyzing German history since around 1870 their advances in Chemistry have always lead or outdid the rest of the world. Engineering reputation is overrated...,literal
Term limits. Period. Less time worrying about fundraising for reelection and more time representing their constituents.,literal
The concept of outside clothes and outside germs is germaphobic and mostly useless. Of course if you have a job where you come in contact with bodily fluids disease and grime that's a different story as you would actually be covered in a higher percentage of potentially dangerous germs and bacteria and changing clothes and showering immediately when you get home would be normal. But if you're just going out shopping or making a quick errand I genuinely think there's something wrong in your brain if you're thinking and worrying about germs and poop particles and whatnot that could potentially be on every surface...,literal
Pope Leo Torches Trump's 'Extremely Disrespectful' Agenda,figurative
Also stop voting for establishment Democrats in the primaries. We need at least one major party in this country that's not bought by billionaires and corroding if we're going to take the government back and make them work for the people again.,figurative
Trump's Niece Torches Him Over 'Despicable' Piggy Insult to Female Reporter | Mary Trump said it would be an insult to pigs to call her uncle one.,figurative
You're right. I was thinking Nixon who only lost Massachusetts in 1972,literal
There was one celeb that did come out and say that they were in the flight logs but were innocent. I think it was Chris Tucker. He's the only one that I've heard mention anything about not being involved in the pedo ring. He was with Bill Clinton and Kevin Spacey for an AIDS/HIV epidemic summit so not the best company to be with lol,literal
How else will I know you aren't holding a dagger in your right hand?,figurative
Attack on Titan is an overhyped show/manga! I never got it. The action sequences were nice and it seemed like the story was going somewhere. But then showing the protagonists as the antagonists was just wild. Trying to make the storyline an allegory of the present-day world was just an overused cliche. And to top it all the ending was simply a cop-out!,figurative
I wouldn't even give two shits whether the US wanted to sanction over it. Ukraine gave away their nukes for guaranteed territorial integrity both Russia and the US agreed to respect it and see where that went. They tariff us on a daily basis anyhow. Might as well make it worth our while.,literal
I'm not talking at all about the past or denying that Dems like Schumer and Biden and Pelosi long overstayed their due and have repeatedly fucked up and disappointed. But the conversation was about what the Dems (any of them) can do moving forward. I'm genuinely asking what Dems can actually do to stop the GOP's agenda now. What exactly are people wanting or expecting? But with regards to this: If the Dems just did X (hold firm on the shutdown not conceding to a handshake deal on extending healthcare subsidies force Mike Johnson to swear in Grijalva before agreeing to end the shutdown force an emergency full funding on SNAP benefits while in shutdown and not accept any concessions until Republicans agree to those terms) then they could stop certain aspects of the GOP's agenda. What would that actually look like? How could the Dems force Johnson and the GOP to make those sizable concessions when those people were perfectly fine continuing the shutdown? Everyone's disappointed with how it ended but I'm not sure how else it would have ended unless we're counting on Republicans to suddenly develop empathy and compassion.,literal
Trump: India's US exports jump despite 50% tariffs as trade tensions ease,figurative
Mike Johnson to back Epstein files discharge petition,literal
India strengthens privacy law with new data collection rules,literal
Because here mods shut down literally everything leading to the same stuff being posted over and over and stagnating on the front page. Then we have the evil twin brother r\trueunpopularopinion which is so unmoderated it has turned into a right wing echo chamber I just want someone looking in the middle of these two extremes.,figurative
Any second now guys we are going to officially start a war with probably Argentina.,figurative
Despite congressional action quick release of Epstein files is in doubt,literal
I miss the 90s trend of clothing having utterly meaningless words on them to look cool One that I will always remember is a jacket that said PACIFIC TEAM SPIRIT BEST QUALITY ATTIRE CASUAL DECK WEAR on it.,literal
Israel used widely banned cluster munitions in Lebanon photos of remnants suggest,literal
Freed from prison by Trump Lakewood con man Eli Weinstein gets 37 years in latest fraud,literal
Bukhari came out 200 years after the Quran. Most Muslims especially those raised in or who live in western countries focus on the Quran itself and don't follow the hadiths (ie Bukhari). The Muslims who believe the Hadiths are more similar to Orthodox or Hasidic Jews. Most Muslims are like the average Jewish person in that sense. The average Jewish person doesn't agree with most of what the Orthodox or Hasidic Jews believe is mandatory.,literal
North Korea Says Seoul Submarine to Have Nuclear Domino Effect,figurative
Poland says 2 Ukrainians working for Russia are suspected of being involved in railway blast,literal
40% of young U.S. women want to leave the country: Gallup poll,literal
Sleeping Dogs is the best GTA game I have consistently come back to this absolute gem since it's release in 2012. Not only is it the best GTA clone ever created I'd argue that it's better than every entry in the GTA franchise. The character development the perks and upgrades available the absolute endless fun of the hand to hand combat the offensive driving... United Front Games truly created a masterpiece.,figurative
Senate officially passes the Epstein files bill sending it to Trump,literal
Welcome to /r/AmITheAsshole. Please view our voting guide here and remember to use only one judgement in your comment. OP has offered the following explanation for why they think they might be the asshole... [continues with subreddit rules and bot message],literal
Prison staff who leaked information about Maxwell's preferential treatment have been fired lawyer says,literal
