text,label
Democrats Claim Florida GOP Rep. Salazar Is In 'Panic' After Sharp Latino Voting Shift in Latest Elections,figurative
In my fairly extensive experience working with lawyers: anything that needs to get done by lower level associates or legal researchers gets done super fast because the whole culture for those folks is working 80 hour weeks to try to get ahead. Anything that needs to get done by older guys and partners takes absolutely forever because they put in their time and are rich and barely do any work anymore. Things like disbarring is a panel of old dudes so yeah good luck getting them to come off the golf course for an hour zoom meeting once a month to talk about it.,literal
https://www.pressdemocrat.com/2025/11/19/economy-jobs-report/,literal
Nepal receives $9.4 million for forest carbon cuts under World Bank's FCPF program,literal
Cover letters are stupid We're not in the 90s anymore. Most jobs are applied online with a clear intent resume and a form to fill. Asking for a required cover letter is plain stupid and a waste of everyone's time involved.,literal
He's following campaign finance law should be the headline. That's all it is after all.,literal
This is a nice poem. :) Hopefully the different way of communication will have a greater impact than what the rest of us managed.,literal
It's a moot point. The war can't be ended by getting people into a room and hammering out a compromise. It must be fought until there's a decisive conclusion on the ground. At that time the parties can horse-trade territory or whatever. The only exception--which is likely but undesirable--is for the war to reach a stalemate. In that case it becomes a frozen conflict ala the Korean War. It would be much better for the US and Europe to back Ukraine until the Russians have to quit. That doesn't mean Ukraine gets all of its pre-2014 territory back however. Ukraine giving up weapons is bad not only for Ukraine but also for Europe/NATO. The country has one of the biggest (if not the biggest) military in Europe. NATO and the EU need it.,figurative
No the ceasefire is not absolute. They have operated according to the negotiated conditions.,literal
Trump's approval falls to lowest of his term over prices and Epstein new poll finds,figurative
Spain Pledges $710 Million in Military Aid to Ukraine,literal
Lengthy record of treating females of all ages like dirt.,figurative
Cold water sucks room temperature water is the best I don't understand people that drink cold water it literally causes the teeth to hurt and you can't gulp it down a lot because it freezes the goddamn neck also it loses it's taste. Room temperature water tastes not better but well it just tastes because it is not covered by being freezing cold also you can drink a lot of it safely to actually satisfy the thirst.,figurative
Ukrainian opposition blocks parliament demands entire government resign over $100M scheme involving Zelenskyy's associate,literal
Well the US/NATO are the ones propping up Ukraine's ability to wage war and were the ones who told them not to take a peace treaty that was offered very early in the conflict so they're not innocent bystanders in all this. And absolutely I wish Russia would just pull out and go home but they are in the advantageous position unfortunately and likely see no reason to throw away their ill-gotten gains,figurative
Hamas simply has to disarm and follow the agreement that is endorsed by all parties including the UN security council,literal
Bangladesh's former PM Sheikh Hasina sentenced to death over student protests,literal
They have to first scrub all the references to Trump and his pedo buddies and replace them all with Bill Clinton,figurative
Aside from the Romeo and Juliet scene Age of Extinction is one of the best Transformers movies. In my rankings it's 2nd just behind DOTM. Cade was a good main character (arguably better than Sam) the designs are the best out of any Transformers film and I found the story enjoyable. I never understood the hate for it,literal
Canada's Carney faces crucial vote on budget that could trigger election,figurative
Russian intelligence likely behind railway sabotage Poland says,literal
sleep deprivation is a serious problem in our society that is always overlooked with the rise of hustle culture and working longer hours to make ends meet sleep is the first thing to be put on the back burner. people meal plan in order to maintain a healthy diet and go on walks during their lunch breaks to ensure exercise but nobody takes the same care to make sure their sleep schedule is balanced everyone has bags under their eyes is addicted to caffeine and brags about not sleeping enough...,figurative
Quit calling the physics constant c the speed of light start calling it the speed of causality. Causality meaning how fast can an action turn into a reaction because even light is beholden to cause and effect.,literal
US unemployment rolls swelled between mid-September and mid-October,figurative
Arby's used to actually be good. For the longest time ive always seen people diss on Arby's. Arby's used to be one of my favorite fast food places to eat. Nothing hit quite like a half pound beef n cheddar with potato cakes and a Dr.Pepper. The only reason I say used to be good is because the arbys in my area have gone extremely down hill. The quality isn't there like it used to be...,figurative
Due to Botched Paperwork Comey May Never Have Been Properly Indicted,literal
720p/1080p still looks good for most games Dont know what all the fuss is about about 4k dosent even look that much different in my opinon sure it looks better but i dont know why i would spend like 300$ for it when 720p/1080p still looks good for most games i would go even as far as saying 480p still looks good but only for some games for games with higher graphics it all gets blurry and besides games arent about the graphics its about the gameplay.,literal
Maybe the massive country two doors down that has explicitly stated their intention to destroy Israel? The two bordering nations that to this day refuse to sign a peace treaty with Israel? Who harbor proxies that threaten Israel?,literal
Overcooked noodles are better than al dante Day old pasta that has been marinating in the sauce overnight is better than fresh cooked pasta. Ramen noodles that get fat from absorbing some soup and is soft enough to just kind of fall apart by smooshing it on the roof of your mouth is better than al dante noodles. Even with fried food fried food that's been doused in sauce and had time to soften up is better than fresh fried crispy ones.,figurative
Dutch Hand Back Control of Chinese-Owned Chipmaker Nexperia,figurative
I haven't shopped regularly at Walmart since pre Covid. Target honestly has a lot of goods priced the same if not even lower than Walmart does. I'd even pay 5-10% more to not have to deal with Walmart people.,literal
People need to step to the right when on elevators or moving sidewalks It is the considerate thing to do. Unless you absolutely have all the luggage that you cant stage it on the side with you there is no reason why you can't stand to the side with your stuff and let others walk past you.,literal
A Chinese firm bought an insurer for CIA agents - part of Beijing's trillion dollar spending spree,figurative
Avatar 2 is a horse girl movie in disguise Most discussions about Avatar 2 was about if it's a good movie or bad about the technical advancements visual effects if it is a cinematic masterpiece or not and other stuff. But my unpopular opinion is that it was a horse girl movie in disguise and apparently no one noticed it just because the gender was switched and the horse was a fancy whale...,figurative
Green bean casserole and sweet potato with marshmallows are gross With Thanksgiving approaching small talk often turns to what people are making or looking forward to having on Thanksgiving. These two dishes seem to come up the most. Green beans are one of my favorite vegetables. Fresh ones from the produce section are the best and frozen are fine but they are one of the worst vegetables to can and most recipes call for canned ones. Then they are covered in some cheesy slop and topped with the crunchy onion things...why are we ruining green beans? Just make a side of fresh ones it's a special meal! Sweet potatoes are already sweet! Adding sugary goo on top is just pointless and buries the taste of the potato. I can only conclude that these recipes were created because people hate vegetables.,figurative
Not really the point. Labor is often 70% of the cost and cheapest vendor often leaves a crew idle and you can't find a similar part that will work. The emergency is the need to stay on schedule or get fired from the current job or miss the next one. Had a crew last year lose a job because they didn't have a part which cost 3 days but that made the us miss the rough inspections which meant the drywall guys went elsewhere and the whole project backed up 3 weeks...,figurative
Everything makes sense once you accept how utterly dumb the average person is..,literal
Putin deepens China ties with visa-free travel regime offer,figurative
Senate ready to quickly pass bill to release Epstein files,literal
It's a democratic hoax. But only democrats are implicated.,figurative
It is not well made at all. The story is all over the place. The world feels small. The characters are inconsistent and so remote from the lore that they're unrecognizable from their LOTR equivalent. The whole time I was watching it I was wondering what the hell was going on… The story is bad and cringe and the show is so so bad that I can't actually believe someone liked it let alone liked it more than The Hobbit. Like you have to be a troll. Please tell me no one actually has your opinion. Please don't make this world even more disappointing than it already is.,literal
To Weaken Minority Voting Power Republicans Push For Unprecedented Mid-Decade Census,literal
Slow cooker food is utterly flavorless Anything you throw into a slow cooker will immediately lose any semblance of flavor no matter how much you season it. I do not understand how people can enjoy slow cooker food if they have alternatives...,literal
LeBron doing gambling ads should damage his legacy more than MJ's gambling habit Michael Jordan's gamble habit while maybe a character sleight is a vice restricted to his own personal life. LeBron James doing advertisements for DraftKings is orders of magnitude more harmful to society because it normalizes gambling to all viewers especially young men who view him as some sort of role model.,literal
Ukraine war briefing: Greece signs deal to supply gas to Kyiv over 'difficult' winter,literal
Leave people's relationships alone. How is this about politics. It should be removed,literal
Canada announces massive jump in funding to European Space Agency,figurative
Trump's Anti-Green Agenda Could Lead to 1.3 Million More Climate Deaths. The Poorest Countries Will Be Impacted Most.,literal
Donald Trump Insists He's 'Not a Sleeper' After Photos of Him Closing Eyes in Oval Office Go Viral,literal
Meta Mega Thread Please post all meta topics here. A meta topic is one that discusses the subreddit itself including how it is moderated its rules its megathreads and so on.,literal
Gears of War is a terrible video game series Now let me start by saying if you like this series it's perfectly fine with me. But I personally really don't get what's so good about Gears of War. I've played the games before and every time I was bored out of my mind. I thought the story and characters were really dumb and wasn't well written at all...,literal
Lots of little toppings fall off and are scooped up at the end. Especially if you don't go heavy on the dressing,literal
Rosneft's Ryazan refinery suspended crude processing after drone strike sources say,literal
Texas' redrawn Congressional map blocked by court in shocking blow to GOP,figurative
Trump Judges Throw Out His Meritless Lawsuit Against CNN,figurative
The insanity of having someone prosecute their very first case ever and it be against the former director of the FBI. Everything else aside she's never done any prosecutorial work in her life and they out her on this nationally high profile case. And despite completely fumbling the ball at every turn and complete ineptitude being on display this administration keeps saying she is doing an excellent job. That's the part that glitches my brain.,figurative
Photos reveal German deputies met in Moscow with sanctioned Russian influence network organizers,literal
If you're romantically/sexually interested in someone you should directly tell them how you feel. Instead of being indirect and trying to make hints that you're interested in someone you should tell them... Life is too short for being indirect.,literal
MI5 warns UK Parliament over risk of Chinese espionage,literal
/r/WorldNews Live Thread: Russian Invasion of Ukraine Day 1363 Part 1 (Thread #1510),literal
NTA. Sounds like Mom doesn't want to do it Dad and fiancé want the traditional walk and you want something different. It is great to honor both parents to but you need to find a way that makes you Mom comfortable. And if you don't want just your Dad then walk by yourself. That is also an option. And while weddings are something you and your fiancé should plan together I don't think he needs to dictate who walks you down the aisle. That is a special moment for YOU with the person or people of your choosing. It doesn't have anything to do with him.,literal
Airbus chair calls on Europe to acquire tactical nuclear weapons,literal
Trump Loyalist Admits Grand Jury Never Saw Final Comey Indictment,literal
Gaming Laptops Gaming laptops are a nice novelty but if you just want to game get a console or actual gaming PC... the battery drains too fast... the cooling systems are not fit for purpose and eventually will overheat/fail... always comes with bloatware pre installed... Other than the utility of being able to do other stuff than gaming is there any benefit?,figurative
Ukraine strikes Russian targets using US ATACMS missiles in first public acknowledgment,literal
Mouses shouldn't have become a standard peripheral My gripe isn't against mouses specifically but any input method that involves manoeuvring a cursor. What annoys me about it is that it uses real number coordinates to navigate around the screen which requires a certain degree of dexterity to press buttons and navigate UI. A keyboard key in contrast is either pressed or not pressed...,literal
Polish train track that helped transport aid to Ukraine destroyed in 'act of sabotage' prime minister says,literal
They need to make a new Cash Cab but with Uber/Lift drivers. The amount of drunk people and fun things they could do would be great especially with updated trivia. Plus most cars already have cameras these days so it wouldn't be weird if you didn't want to play.,literal
Overnight oats suck I've tried to like overnight oats. They're relatively cheap easy to make decently nutritious easy to grab on the go. I've tried every combination and every flavor and they all taste horrible. I even like regular oatmeal.,literal
Edit to add more information on what I mean by significant digit: The more change you get when you modify a digit the greater it's significance. The 1st digit of YYYY is most significant because a change in that is +/- 1000 years (e.g. 2025 > 3025) where as the 2nd digit of DD is the least significant. I guess my unpopular opinion is that digits should be taken into account for a format and neither DD/MM/YYYY and MM/DD/YYYY properly sorts by digits. Typo: meant to say the argument that DD/MM/YYY... So... YDMMYYYD? So today date 19/11/2025 would be 21110259 Or are you really badly arguing for YYYY/MM/DD,literal
Ah the ol' red hands dog whistle popularized by celebrities at the Oscars.,figurative
Not 'a ton of optimism' Putin wants Ukraine peace Canadian official says,literal
MBS tells Trump he wants to join Abraham Accords but path to Palestinian state crucial,literal
You serious bro? The prophet himself engaged in and promoted sexual slavery. This idea that Islam has some sort of clear-cut zero-tolerance policy on rape is PC nonsense.,literal
Donating money doesn't make you a good person A lot of time I have seen people defending celebs and influencers by saying They do a lot of charity. I don't think charity makes you a good person. Charity is like investment to them. It just to make themselves look good and make money. They don't really give a shit about anyone. Secondly If someone is earning 2-3 million a year then donating like 1% of your income to charity doesn't mean shit. Not everyone is bad tho. There are genuine good celebs out there but protecting them by saying they so charity is stupid and you should be in jail for being stupid.,literal
The worst part about getting rid of pennies is losing the souvenir coin machines Yeah sure pennies are basically useless. No one actually wants them jingling around in their pockets. But. Those little penny press machines at zoos museums and theme parks? Absolute classics. They cost like 51¢ make that satisfying crank-crank-crank noise and give you a tiny piece of shiny nostalgia to take home. Now with pennies being phased out those machines are basically doomed — and honestly that's the real tragedy here.,figurative
Trump will 'do everything possible' to prevent Bondi DOJ from releasing Epstein files: Rep. Crow,literal
Put Guillermo del Toro in charge of Dark Universe His version of Frankenstein is the best film version of that story to ever exist... If they were at all smart they'd just give del Toro the reigns say it's all yours make it work and not change anything he does.,figurative
Indonesia's Semeru volcano erupts alert level raised to highest | News,literal
I'm not sure going after former office holders and a non voting member is going to move the needle much.,figurative
Decorated agent trainee fired over Pride flag warns new 'Lavender Scare' is spreading 'like wildfire' at FBI,figurative
